{
  "$schema": "http://json-schema.org/draft-07/schema#",
  "title": "ModelResponseSchema",
  "description": "Standardized schema for model evaluation responses saved as data/responses/Q{ID}_{MODEL}.json",
  "type": "object",
  "properties": {
    "question_id": {
      "type": "string",
      "description": "Unique identifier for the question (e.g. Q01, Q02)",
      "pattern": "^Q[0-9]{2,}$"
    },
    "model": {
      "type": "string",
      "description": "Canonical Ollama model tag or name (e.g. phi4-mini-reasoning, deepseek-r1:7b, qwen3:8b)"
    },
    "prompt": {
      "type": "string",
      "description": "The input prompt submitted to the model"
    },
    "response": {
      "type": "string",
      "description": "The raw text response output by the model"
    },
    "timestamp": {
      "type": "string",
      "format": "date-time",
      "description": "ISO 8601 formatted timestamp when the response was generated"
    }
  },
  "required": [
    "question_id",
    "model",
    "prompt",
    "response",
    "timestamp"
  ],
  "additionalProperties": false
}
