{
  "question_id": "Q06",
  "model": "phi4-mini-reasoning",
  "prompt": "A farmer has 17 sheep, and all but 9 die. How many live sheep does the farmer have left? State your answer and briefly explain the logic.",
  "response": "<think>\nOkay, let's see. The problem says a farmer has 17 sheep, and all but 9 die. How many live sheep does the farmer have left? Hmm. So, the farmer starts with 17 sheep. Then \"all but 9 die.\" Wait, \"all but 9\" die. So, does that mean that except for 9 sheep, all die? Or does it mean that all die except for 9? Let me parse this sentence again.\n\nThe phrase \"all but 9 die\" – \"but\" here is used to contrast. So, it's like saying \"everyone except for 9 die,\" which would mean that 9 sheep do not die, and all the others die. So, if the farmer originally has 17 sheep, and all but 9 die, then 9 survive, and 17 minus 9 die. So, 17 - 9 = 8. Wait, no. Wait, if all but 9 die, then the number that die is total minus 9. So, 17 total sheep, all but 9 die, so 17 - 9 = 8 sheep die, and 9 survive. Therefore, the farmer has 9 live sheep left.\n\nBut wait, let me make sure. Sometimes these problems can be tricky with the wording. Let's break it down. \"All but 9 die\" – \"all\" refers to the entire group except for 9. So, out of the 17 sheep, \"all\" would mean every sheep, but there's an exception: 9 that don't die. So, 9 sheep survive, and the remaining (17 - 9 = 8) die. Therefore, the answer should be 9.\n\nAlternatively, someone might misinterpret \"all but 9 die\" as \"first, all die, but then 9 remain,\" but that doesn't make sense. The correct interpretation is that except for 9, all the sheep die. So, 8 die, 9 survive. So, the farmer has 9 live sheep left.\n\nAnother way to think about it: \"all but X\" means \"completely except for X.\" So, if you have all but X of something, that means you have X left and the rest are excluded. For example, if I say \"all but one of the cookies were eaten,\" that means one cookie remains.Even more clearly, if the problem had said \"all but 9 died,\" then the number of living sheep would be 9. Because \"all but 9\" refers to the dying ones, so 9 live.\n\nSo, the key is understanding that \"all but 9\" die. So, the death toll is 17 - 9 = 8, and survivors are 9. Therefore, the answer is 9.\n</think>\n\nThe farmer originally has 17 sheep. The phrase \"all but 9 die\" means that **9 sheep survive**, and the remaining **17 - 9 = 8** die. \n\n**Answer:** \\boxed{9}  \n*Logic:* \"All but 9 die\" implies 9 sheep do not die (survive), so the farmer has 9 live sheep left.",
  "timestamp": "2026-09-16T04:59:00Z"
}