{
  "question_id": "Q01",
  "model": "qwen3:8b",
  "prompt": "Solve for x: 3x + 12 = 30. Show each step of your calculation clearly and state the final numerical value of x.",
  "response": "<think>\nOkay, so I need to solve the equation 3x + 12 = 30 for x. Let me think about how to approach this. I remember that solving an equation like this usually involves isolating the variable, which in this case is x. \n\nFirst, I should get rid of that constant term on the left side, which is +12. To do that, I can subtract 12 from both sides of the equation. That way, I keep the equation balanced. Let me write that down:\n\n3x + 12 - 12 = 30 - 12\n\nSimplifying both sides, the +12 and -12 on the left side cancel each other out, leaving just 3x. On the right side, 30 minus 12 is 18. So now the equation is:\n\n3x = 18\n\nAlright, now I need to get x by itself. Since 3 is multiplied by x, I should divide both sides by 3 to undo that multiplication. Let me do that step:\n\n3x / 3 = 18 / 3\n\nSimplifying again, the 3's on the left side cancel out, leaving just x. On the right side, 18 divided by 3 is 6. So that gives me:\n\nx = 6\n\nWait, let me check if that makes sense. If I plug x = 6 back into the original equation, does it hold true?\n\nOriginal equation: 3x + 12 = 30\n\nSubstitute x with 6: 3*(6) + 12 = 18 + 12 = 30. Yep, that equals 30, which matches the right side of the equation. So it looks like x = 6 is the correct solution.\n\nHmm, did I miss any steps? Let me go through it again. Starting with 3x + 12 = 30. Subtract 12 from both sides: 3x = 18. Divide by 3: x = 6. Yep, that seems straightforward. I don't think I made any mistakes here. The key steps were subtracting 12 first and then dividing by 3. It's important to perform the same operation on both sides to maintain equality. \n\nAnother way to think about it might be to first divide all terms by 3, but that might complicate things because of the +12. Let me try that approach just to verify. If I divide every term by 3:\n\n(3x)/3 + 12/3 = 30/3\n\nWhich simplifies to x + 4 = 10. Then subtract 4 from both sides: x = 10 - 4 = 6. Oh, that works too! So whether I subtract first or divide first, I still end up with x = 6. That gives me more confidence that the answer is correct. \n\nSo both methods lead to the same result. It's good to check using different methods to ensure consistency. I think that's all there is to it. The solution is x equals 6.\n\n</think>\n\nTo solve the equation $ 3x + 12 = 30 $, we aim to isolate the variable $ x $ step by step.\n\n---\n\n### **Step 1: Subtract 12 from both sides**\n\nWe begin by eliminating the constant term on the left-hand side. To do this, subtract 12 from both sides of the equation:\n\n$$\n3x + 12 - 12 = 30 - 12\n$$\n\nSimplifying both sides:\n\n$$\n3x = 18\n$$\n\n---\n\n### **Step 2: Divide both sides by 3**\n\nNow, to isolate $ x $, divide both sides of the equation by 3:\n\n$$\n\\frac{3x}{3} = \\frac{18}{3}\n$$\n\nSimplifying:\n\n$$\nx = 6\n$$\n\n---\n\n### **Final Answer**\n\n$$\n\\boxed{6}\n$$",
  "timestamp": "2026-09-16T04:36:45Z"
}