{
  "question_id": "Q_CUSTOM",
  "model": "phi4-mini-reasoning",
  "prompt": "what is 8+2",
  "response": "<think>\nOkay, so I need to figure out what 8 plus 2 is. Let me start by recalling how addition works. Addition is combining two numbers to get a total sum. So if I have 8 items and someone gives me 2 more, how many do I have in total?\n\nLet me count them out.Let's see, starting from 8: 9, 10, 11, 12, 13, 14, 15, 16. Wait, that's 8 numbers adding one each time. So 8 plus 2 should be 10 + (2) which is 12? Hmm, wait, maybe I confused something here.\n\nWait, no. Let me try another approach. I know that 8 + 1 is 9, right? So if I have 8 and I add 1 more, that's 9. Then I need to add another 1 to get to 10. But since I'm only adding 2, that's two ones. So 8 + 2 would be 10 + 1 + 1, which is 10 + 2 = 12? Wait, no, that's not right. Because 8 + 1 is 9, then 9 +1 is 10. So 8 +2 is 10. Wait, now I'm confused.\n\nWait, maybe I made a mistake in my counting earlier. Let me count again. Starting at 8, adding the first 2: 8 +2. Let's visualize it. If I have 8 apples and add 2 more, how many apples do I have? Let's count: 8, add one apple → 9, another one → 10. So 8 +2 equals 10. But earlier when I counted up to 16, that was adding 8 numbers, which would be 8+8=16? Wait, no, that's multiplication. Wait, no, addition is sequential. So 8 plus 8 would be 16, but 8 plus 2 is different.\n\nI think my confusion came from maybe counting up to 16 by adding 8 increments, but that's not relevant here. Let me correct that. So 8 plus 2: start at 8, count up by 2. So 9, 10. That's two numbers. So 8 +2 =10. Yes, that makes sense. So the answer should be 10. But why did I get confused earlier? Maybe I mixed up addition with something else. Let me check with another method. Using number lines: starting at 8, take two steps forward. First step to 9, second step to 10. Yep, that's 10. So 8+2=10. I think that's correct. To confirm, I can subtract: if 8+2=10, then 10-8=2, which is the additive inverse. That checks out. So the answer is 10.\n</think>\n\nThe problem requires calculating the sum of 8 and 2. \n\n1. **Understanding Addition**: Addition combines two numbers to find their total. Here, we combine 8 and 2.\n2. **Counting Method**: Starting at 8 and adding 2 steps:\n   - 8 + 1 = 9  \n   - 9 + 1 = 10  \n   Thus, 8 + 2 = 10.\n3. **Verification**: Using subtraction to check:  \n   If 8 + 2 = 10, then 10 − 8 should equal 2, which confirms the result.\n\n**Answer**: \\boxed{10}",
  "timestamp": "2026-09-13T14:37:07Z"
}