{
  "question_id": "Q11",
  "model": "deepseek-r1:7b",
  "prompt": "Write a clean Python function `is_palindrome(s: str) -> bool` that checks if a string is a palindrome, ignoring non-alphanumeric characters and case. Provide a brief trace of why it works.",
  "response": "<think>\nOkay, I need to write a Python function called is_palindrome that checks if a string is a palindrome, but ignoring non-alphanumeric characters and case. Hmm, let's think about how to approach this.\n\nFirst, what's a palindrome? It's a string that reads the same backward as forward. But I need to ignore non-alphanumeric characters and case. So, for example, \"A man, a plan, a canal: Panama\" should return True because when you remove the non-alphanumeric characters and make everything lowercase, it's a palindrome.\n\nSo, the steps I need to take are:\n\n1. Preprocess the string: remove all non-alphanumeric characters and convert to lowercase.\n2. Check if the resulting string is a palindrome.\n\nHow do I preprocess the string? I can loop through each character in the string and check if it's alphanumeric. Alternatively, I can use the isalnum() method, which returns True if the character is alphanumeric. But wait, I also need to ignore case, so converting to lowercase first might be easier.\n\nWait, actually, I can create a new string that includes only the alphanumeric characters, converted to lowercase. So, for each character in s, if char.isalnum(), then include char.lower() in the new string.\n\nYes, that makes sense. So, I can do something like:\n\nfiltered = [c.lower() for c in s if c.isalnum()]\n\nThen, join this list into a string: filtered_str = ''.join(filtered)\n\nOnce I have this filtered string, I need to check if it's a palindrome. How to do that? Well, a string is a palindrome if it equals its reverse. So, I can compare filtered_str to filtered_str[::-1].\n\nAlternatively, I can check if the string is equal to its reversed version.\n\nPutting it all together, the function would look like:\n\ndef is_palindrome(s: str) -> bool:\n    filtered = [c.lower() for c in s if c.isalnum()]\n    filtered_str = ''.join(filtered)\n    return filtered_str == filtered_str[::-1]\n\nWait, but what about empty strings? If the string has no alphanumeric characters, then filtered_str would be empty. An empty string is technically a palindrome because it reads the same backward and forward. So, the function would return True, which is correct.\n\nLet me test this logic with some examples.\n\nExample 1: s = \"A man, a plan, a canal: Panama\"\nFiltered string would be \"amanaplanacanalpanama\", which is a palindrome. So, function returns True.\n\nExample 2: s = \"race a car\"\nFiltered string is \"racecar\", which is a palindrome. So, returns True.\n\nExample 3: s = \"No 'x' in Nixon\"\nFiltered string is \"noinxinxion\", which is not a palindrome. Wait, no, let me see: \"No'x'in Nixon\" becomes \"noinxnnxion\"? Wait, maybe I should think again.\n\nWait, \"No 'x' in Nixon\" becomes \"noxinxion\" when filtered. Wait, no, let's process each character:\n\nN -> n\no -> o\n' -> ignored\nx -> x\n' -> ignored\ni -> i\nn -> n\n ' -> ignored\nN -> n\ni -> i\nx -> x\no -> o\nn -> n\n\nSo, the filtered string is \"noxnnxion\". Wait, no, let me write it step by step:\n\nOriginal string: \"No 'x' in Nixon\"\n\nBreaking it down:\nN -> n\no -> o\n' -> skip\nx -> x\n' -> skip\ni -> i\nn -> n\n ' -> skip\nN -> n\ni -> i\nx -> x\no -> o\nn -> n\n\nSo, the filtered string is \"noxnnxion\". Wait, that's 9 characters. Let's see: n o x n n x i o n. Wait, no, that's 9 letters. Wait, maybe I made a mistake.\n\nWait, \"No 'x' in Nixon\" is:\n\nN o ' x ' i n ' N i x o n\n\nSo, the filtered string is N o x i n N i x o n, converted to lowercase: n o x i n n i x o n.\n\nWait, that's 11 characters: n o x i n n i x o n.\n\nWait, no, let's count:\n\nN o ' x ' i n ' N i x o n\n\nSo, the characters are N, o, x, i, n, N, i, x, o, n.\n\nWait, that's 10 characters. So, the filtered string is \"noxni xion\"? Wait, no, it's \"noxniNixion\"? Wait, no, let's process each character:\n\n1. N -> n\n2. o -> o\n</think>\n\n",
  "timestamp": "2026-09-16T05:23:45Z"
}