{
  "question_id": "Q14",
  "model": "deepseek-r1:7b",
  "prompt": "Describe Floyd's Cycle-Finding Algorithm (Tortoise and Hare) for detecting a loop in a singly linked list. Explain why the time complexity is O(N) and the auxiliary space complexity is O(1).",
  "response": "<think>\nOkay, so I need to explain Floyd's Cycle-Finding Algorithm, also known as the Tortoise and Hare algorithm, for detecting a loop in a singly linked list. I also have to explain why its time complexity is O(N) and why its auxiliary space complexity is O(1). Hmm, let me think about how to approach this.\n\nFirst, I remember that Floyd's algorithm is used to detect cycles in linked lists. It's efficient because it only uses two pointers, which makes it both time and space efficient. I think the algorithm works by having two pointers move through the list at different speeds—one moves one step at a time (the tortoise), and the other moves two steps at a time (the hare). If there's a cycle, these pointers will eventually meet somewhere inside the cycle.\n\nWait, but how exactly does that work? Let me visualize a linked list with a cycle. Suppose we have nodes A -> B -> C -> D -> B. So, the hare starts at A, moves to B, then to C, then to D, then back to B. The tortoise starts at A, moves to B, then to C, then to D, then to B. So, when the hare moves two steps each time, it would go A -> B (first step), then C (second step), then D (third step), then B (fourth step). The tortoise, moving one step each time, would be at A, B, C, D, B. So, they meet at B. That makes sense.\n\nBut if there's no cycle, like a singly linked list with a tail, the hare will reach the end of the list before the tortoise, right? Because the hare is moving twice as fast. So, if the hare reaches the end, we know there's no cycle.\n\nNow, why is the time complexity O(N)? Well, in the worst case, the tortoise and hare will traverse the list once each. Since the hare moves twice as fast, it will meet the tortoise within N steps, where N is the length of the list. If there's a cycle, they meet within N steps; if not, the hare exits the list in N/2 steps. So, the maximum number of steps is proportional to N, hence O(N).\n\nAs for the space complexity, it's O(1) because we're only using two pointers—no additional data structures are needed. So, regardless of the list size, the memory used doesn't grow with N.\n\nWait, but what if the cycle is very small? Like just two nodes. Does the algorithm still work? Let me think. If the list is A -> B -> A, then the tortoise starts at A, moves to B, then back to A. The hare starts at A, moves to B, then back to A. So, they meet at A, which is correct. If the cycle is longer, say three nodes, they should still meet somewhere inside the cycle.\n\nWhat about edge cases? If the list has only one node, there's no possibility of a cycle. If the list has two nodes, A -> B, no cycle. If it's A -> A, that's a cycle of length 1. The algorithm should handle all these cases.\n\nI should also consider the steps in detail. The algorithm initializes two pointers, tortoise and hare, both starting at the head. Then, it moves them: tortoise moves one step, hare moves two steps, and this continues until they meet or the hare reaches the end. If they meet, there's a cycle; otherwise, no cycle.\n\nSo, putting it all together, the algorithm is efficient because it uses constant space and linear time. It's a clever way to detect cycles without using extra memory beyond two pointers.\n\nI think I've got a good grasp on it now. Let me try to summarize it step by step.\n\n</think>\n\nFloyd's Cycle-Finding Algorithm, also known as the Tortoise and Hare algorithm, is a method to detect cycles in a singly linked list. Here's a step-by-step explanation:\n\n1. **Initialization**: Start with two pointers, `tortoise` and `hare`, both initialized to the head of the linked list.\n\n2. **Traversal**:\n   - Move `tortoise` one step at a time.\n   - Move `hare` two steps at a time.\n\n3. **Cycle Detection**:\n   - If the hare catches up to the tortoise, a cycle exists in the list.\n   - If the hare reaches the end of the list, there is no cycle.\n\n4. **Efficiency**:\n   - **Time Complexity**: O(N), where N is the number of nodes. The algorithm ensures that each node is visited at most twice (once by each pointer), leading to linear time complexity.\n   - **Space Complexity**: O(1), as only two pointers are used, regardless of the list size.\n\nThis algorithm efficiently detects cycles",
  "timestamp": "2026-09-16T05:27:01Z"
}