{
  "question_id": "Q13",
  "model": "phi4-mini-reasoning",
  "prompt": "Identify the bug in the following binary search implementation and explain how to fix it:\n\ndef binary_search(arr, target):\n    low = 0\n    high = len(arr)\n    while low < high:\n        mid = (low + high) // 2\n        if arr[mid] == target:\n            return mid\n        elif arr[mid] < target:\n            low = mid\n        else:\n            high = mid - 1\n    return -1",
  "response": "<think>\nOkay, let's take a look at this binary search code. Hmm, the user says there's a bug here. Let me walk through the code step by step.\n\nSo the function is binary_search, which takes an array and a target. The initial setup seems right: low starts at 0, high at the length of the array. The loop runs while low is less than high. Then mid is calculated as (low + high) // 2. \n\nWait, in each iteration, if the target is found at arr[mid], return mid. That's correct. Now, if arr[mid] is less than target, they set low to mid. But wait, in binary search, when the middle element is less than the target, you need to move the lower bound up to mid to look in the upper half. But here, they set low = mid. That seems right. But what if the array isn't sorted? Oh, but binary search assumes the array is sorted. So maybe the bug isn't here. \n\nWait, let's think about the case where the loop exits. If the loop exits without returning, then the target isn't found, so return -1. That's correct. \n\nWait, maybe the problem is with how mid is calculated. Let's take an example. Suppose the array is [1, 3, 5, 7, 9] and target is 7. Let's see:\n\nInitial low=0, high=5. mid=(0+5)//2=2. arr[2] is 5. Since 5 <7, so low becomes 2. Now low is 2, high is5. mid=(2+5)//2=3. arr[3] is7, which matches, return 3. Correct.\n\nAnother example: target is 8. Let's see. Initial low=0, high=5. mid=2, arr[2]=5 <8. So low=2. Next loop: low=2, high=5. mid= (2+5)//2=3. arr[3]=7 <8. low=3. Now low=3, high=5. mid= (3+5)//2=4. arr[4]=9>8. So high=4. Now low=3, high=4. mid=3.5? Wait, no, mid is (3+4)//2=3.5? Wait, no, in Python, integer division. So 3+4 is 7, divided by 2 is 3.5, but integer division would be 3. So mid=3. arr[3] is9>8. So high=4-1=3. Now low and high are both 3. So loop exits. Return -1. Which is correct because 8 isn't in the array. So that works.\n\nWait, maybe the bug is when the array has even number of elements. Let's take an example where the target is in the middle. Hmm. Let's try an array [2,4,6,8,10]. Target is 6. Initial low=0, high=5. mid=2. arr[2]=6, return 2. Correct.\n\nAnother test case: array [5, 10, 15, 20, 25], target 15. low=0, high=5. mid=2 (5+5//2= (0+5)//2=2.5? No, wait (0+5)=5//2=2. So mid=2. arr[2] is15. Return 2. Correct.\n\nWait, maybe the problem is when the array has only one element. Let's say arr is [3], target is3. Then low=0, high=1. mid=0.5? No, (0+1)//2=0. So mid=0. arr[0] is3, return 0. Correct.\n\nHmm. What about when the array is empty? Then len(arr) is 0, so high is 0. low starts at 0. low < high is 0 <0? No. So loop doesn't run. Return -1. Correct.\n\nWait, maybe the problem is with the initial high. Because in Python, len(arr) gives the number of elements. So high is set to len(arr), which is correct. But in some languages, the high might be set to len(arr)-1. Wait, but in Python, the indexes are from 0 to len(arr)-1. So if high is set to len(arr), then mid could be calculated as (low + high)//2. For example, if arr has length 5, high is 5. So mid could be (0+5)//2=2 (since 5//2 is 2 in integer division). Which is correct. So that's okay.\n\nWait, maybe the bug is when the array is not sorted. But binary",
  "timestamp": "2026-09-16T05:19:11Z"
}