{
  "question_id": "Q10",
  "model": "deepseek-r1:7b",
  "prompt": "On an island, inhabitants are either Knights (who always tell the truth) or Knaves (who always lie). You meet two inhabitants, A and B. A says: 'At least one of us is a Knave.' Determine precisely what A is and what B is. Provide a rigorous proof by cases.",
  "response": "<think>\nOkay, so I have this logic puzzle here about two inhabitants, A and B, on an island where everyone is either a Knight who always tells the truth or a Knave who always lies. A says, \"At least one of us is a Knave.\" I need to figure out whether A is a Knight or a Knave, and the same for B. Hmm, let me think through this step by step.\n\nFirst, let me recall that Knights always tell the truth, so whatever they say must be true. Knaves always lie, so whatever they say must be false. So, if A is a Knight, then A's statement must be true. If A is a Knave, then A's statement must be false.\n\nA says, \"At least one of us is a Knave.\" So, let's break this down. The statement \"at least one of us is a Knave\" can be translated into logical terms as \"A is a Knave or B is a Knave.\" In symbols, that would be A ∨ B, where A and B represent whether A and B are Knaves, respectively. Wait, actually, hold on. If A is a Knight, then A tells the truth, so \"at least one of us is a Knave\" must be true. If A is a Knave, then the statement is false, so \"at least one of us is a Knave\" is false, meaning neither A nor B is a Knave, so both would be Knights.\n\nBut wait, if both are Knights, then A's statement would be true, which is consistent because A is a Knight. But hold on, if A is a Knight, then A's statement is true, so at least one of them is a Knave. But if A is a Knight, then B must be the Knave. So, that would mean B is a Knave.\n\nAlternatively, if A is a Knave, then A's statement is false. So, the statement \"at least one of us is a Knave\" is false. If that's the case, then the opposite must be true, which is \"neither of us is a Knave,\" meaning both A and B are Knights. But if both are Knights, then A's statement would be true, which contradicts the assumption that A is a Knave. So, that can't be the case.\n\nWait, so if A is a Knave, then A's statement is false, which would mean that neither A nor B is a Knave, so both are Knights. But if both are Knights, then A's statement is true, which can't be because A is supposed to be a Knave. So, that leads to a contradiction. Therefore, A cannot be a Knave. Therefore, A must be a Knight, and since A is a Knight, A's statement is true, so at least one of them is a Knave. Since A is a Knight, that means B must be the Knave.\n\nLet me write this out in a more structured way to make sure I haven't missed anything.\n\nCase 1: A is a Knight.\n- If A is a Knight, then A's statement is true.\n- A's statement: \"At least one of us is a Knave.\" So, this is true.\n- Since A is a Knight, the only way for the statement to be true is if B is a Knave.\n- Therefore, in this case, A is a Knight, and B is a Knave.\n\nCase 2: A is a Knave.\n- If A is a Knave, then A's statement is false.\n- A's statement: \"At least one of us is a Knave.\" So, the negation is \"Neither of us is a Knave,\" meaning both A and B are Knights.\n- But if both A and B are Knights, then A's statement would be true, which contradicts the assumption that A is a Knave.\n- Therefore, this case leads to a contradiction, so it cannot be true.\n\nSince Case 2 leads to a contradiction, it must be false. Therefore, Case 1 must be true. So, A is a Knight, and B is a Knave.\n\nWait, just to double-check, let me consider the possibilities:\n\n1. A is a Knight, B is a Knight.\n   - A's statement: \"At least one of us is a Knave.\" This would be false because both are Knights. But A is a Knight, so he must tell the truth. Contradiction.\n\n2. A is a Knight, B is a Knave.\n   - A's statement: \"At least one of us is a Knave.\" This is true because B is a Knave. So, consistent.\n\n3. A is a Knave, B is a Knight.\n   - A's statement: \"At least one of us is a Knave.\" Since A is a Knave, the\n</think>\n\n",
  "timestamp": "2026-09-16T04:27:36Z"
}