{
  "question_id": "Q13",
  "model": "deepseek-r1:7b",
  "prompt": "Identify the bug in the following binary search implementation and explain how to fix it:\n\ndef binary_search(arr, target):\n    low = 0\n    high = len(arr)\n    while low < high:\n        mid = (low + high) // 2\n        if arr[mid] == target:\n            return mid\n        elif arr[mid] < target:\n            low = mid\n        else:\n            high = mid - 1\n    return -1",
  "response": "<think>\nOkay, so I need to figure out what's wrong with this binary search implementation. Let me look at the code step by step.\n\nThe function is called binary_search and takes an array 'arr' and a target value. It initializes 'low' to 0 and 'high' to the length of the array. Then it enters a while loop that continues as long as 'low' is less than 'high'.\n\nInside the loop, it calculates 'mid' as the average of 'low' and 'high', using integer division. Then it checks if the element at 'mid' is equal to the target. If so, it returns 'mid'. That seems correct.\n\nIf the element at 'mid' is less than the target, it sets 'low' to 'mid'. Wait, that doesn't seem right. Because if the middle element is less than the target, the target must be in the right half, so shouldn't 'low' be set to 'mid + 1'? Otherwise, it might miss the target.\n\nSimilarly, if the element at 'mid' is greater than the target, it sets 'high' to 'mid - 1'. That part seems correct because we need to search the left half.\n\nSo the bug is probably in the case where the middle element is less than the target. Instead of setting 'low' to 'mid', it should be set to 'mid + 1'. Otherwise, the search could stop too early or miss the target entirely.\n\nLet me test this with an example. Suppose the array is [1, 2, 3, 4, 5], and the target is 3.\n\nFirst iteration: low=0, high=5. mid=(0+5)//2=2. arr[mid]=3, which is the target, so it returns 2. That's correct.\n\nAnother example: target is 4. First mid is 2, arr[mid]=3 <4, so low becomes 3. Next iteration: low=3, high=5. mid=(3+5)//2=4. arr[4]=5>4, so high becomes 3. Now low=3, high=3, loop ends, returns -1. Wait, that's wrong because 4 is in the array. Oh, wait, no, in the array [1,2,3,4,5], 4 is at index 3. So when mid is 4, arr[mid] is 5, which is greater than 4, so high becomes 3. Now low is 3, high is 3, loop exits, returns -1. That's incorrect because 4 is present.\n\nWait, that's a problem. So the code isn't finding 4 because when mid is 4, it's set to high=3, but then low is 3, high is 3, so the loop stops. So the bug is that when the target is found in the right half, the code doesn't correctly adjust the high.\n\nWait, no, in the first case, when target is 4, the first mid is 2, which is 3. Since 3 <4, low becomes 3. Now low=3, high=5. Mid is (3+5)//2=4. arr[4] is 5, which is >4, so high becomes 3. Now low=3, high=3, loop ends, returns -1. So the code misses the target.\n\nSo the issue is that when the middle element is less than the target, the code sets low to mid, but it should set it to mid +1. Similarly, when the middle is greater, it sets high to mid -1, which is correct.\n\nSo the fix is to change the 'low = mid' to 'low = mid + 1' in the case where arr[mid] < target.\n\nLet me adjust the code accordingly and test again.\n\nIn the example where target is 4:\n\nFirst iteration: low=0, high=5. mid=2, arr[mid]=3 <4, so low becomes 3.\n\nSecond iteration: low=3, high=5. mid=(3+5)//2=4. arr[mid]=5>4, so high becomes 3.\n\nNow low=3, high=3, loop ends, returns -1. Still not working.\n\nWait, maybe I made a mistake in the example. Let me try with a different array.\n\nSuppose the array is [1,3,5,7], target is 5.\n\nFirst mid is (0+4)//2=2. arr[2]=5, returns 2. Correct.\n\nAnother example: target is 7.\n\nFirst mid=2, arr[2]=5 <7, so low=3.\n\nNow low=3, high=4. mid=(3+4)//2=3. arr[3]=7, returns 3.\n</think>\n\n",
  "timestamp": "2026-09-16T05:25:52Z"
}