{
  "question_id": "Q08",
  "model": "deepseek-r1:7b",
  "prompt": "Alice, Bob, and Charlie are sitting in a row. Alice is not on the far right. Bob is sitting to the immediate right of Alice. Who is sitting on the far left? Deduce the exact left-to-right seating arrangement step by step.",
  "response": "<think>\nFirst, I note that Alice is not sitting on the far right. This means Alice can be either in the first or the second position.\n\nNext, Bob is sitting immediately to the right of Alice. If Alice is in the first position, then Bob must be in the second position. This would leave Charlie to be in the third position.\n\nIf Alice were in the second position, Bob would have to be in the third position. However, this would place Alice in the middle, which contradicts the information that Alice is not on the far right.\n\nTherefore, the only valid arrangement is Alice in the first position, Bob in the second position, and Charlie in the third position.\n\n</think>\n\nLet's determine the seating arrangement step by step.\n\n1. **Alice is not on the far right.**\n   - This means Alice can be either in the first or the second position.\n\n2. **Bob is sitting immediately to the right of Alice.**\n   - If Alice is in the first position, then Bob must be in the second position.\n   - If Alice is in the second position, then Bob would have to be in the third position.\n\n3. **Analyzing the possibilities:**\n   - **Case 1:** Alice in the first position.\n     - Bob is in the second position.\n     - Charlie must be in the third position.\n     - **Seating Arrangement:** Alice (1st), Bob (2nd), Charlie (3rd).\n   - **Case 2:** Alice in the second position.\n     - Bob is in the third position.\n     - This would place Alice in the middle, which contradicts the information that Alice is not on the far right.\n     - **This case is invalid.**\n\n4. **Conclusion:**\n   - The only valid seating arrangement is:\n     - **Alice** in the first position.\n     - **Bob** in the second position.\n     - **Charlie** in the third position.\n\n\\[\n\\boxed{\\text{Alice, Bob, Charlie}}\n\\]",
  "timestamp": "2026-09-16T04:24:59Z"
}