{
  "question_id": "Q04",
  "model": "qwen3:8b",
  "prompt": "Find the next two numbers in the sequence: 2, 6, 12, 20, 30, ... Explain the underlying rule governing the pattern.",
  "response": "<think>\nOkay, let's see. I need to find the next two numbers in the sequence: 2, 6, 12, 20, 30, ... and explain the rule. Hmm, let me start by looking at the differences between the numbers. \n\nFirst, let me write down the terms with their positions to see if that helps. Let's say the first term is term 1, second term is term 2, etc.\n\nTerm 1: 2  \nTerm 2: 6  \nTerm 3: 12  \nTerm 4: 20  \nTerm 5: 30  \nTerm 6: ?  \nTerm 7: ?\n\nNow, let me calculate the differences between consecutive terms. \n\nTerm 2 - Term 1 = 6 - 2 = 4  \nTerm 3 - Term 2 = 12 - 6 = 6  \nTerm 4 - Term 3 = 20 - 12 = 8  \nTerm 5 - Term 4 = 30 - 20 = 10  \n\nSo the differences between the terms are 4, 6, 8, 10... That seems like an arithmetic sequence where each difference increases by 2. Let me check:\n\nFirst difference: 4  \nSecond difference: 6 (which is 4 + 2)  \nThird difference: 8 (which is 6 + 2)  \nFourth difference: 10 (which is 8 + 2)  \n\nYes, so the differences are increasing by 2 each time. If this pattern continues, the next difference should be 10 + 2 = 12. Therefore, Term 6 would be Term 5 + 12 = 30 + 12 = 42. Then the following difference would be 12 + 2 = 14, making Term 7 = 42 + 14 = 56. \n\nBut let me verify if there's another way to look at this sequence. Sometimes sequences can be represented by formulas involving n, the term number. Let me check if there's a formula for the nth term.\n\nLooking at the terms:\n\nTerm 1: 2  \nTerm 2: 6  \nTerm 3: 12  \nTerm 4: 20  \nTerm 5: 30  \n\nHmm, these numbers look familiar. Let me think... 2 is 1×2, 6 is 2×3, 12 is 3×4, 20 is 4×5, 30 is 5×6. Oh! So each term is n multiplied by (n + 1), where n starts at 1. Let me check:\n\nFor Term 1: 1×(1+1) = 1×2 = 2 ✔️  \nTerm 2: 2×(2+1) = 2×3 = 6 ✔️  \nTerm 3: 3×4 = 12 ✔️  \nTerm 4: 4×5 = 20 ✔️  \nTerm 5: 5×6 = 30 ✔️  \n\nYes! So the general formula for the nth term is n(n + 1). Therefore, Term 6 would be 6×7 = 42, and Term 7 is 7×8 = 56. That matches the earlier result from the differences. \n\nSo both methods lead to the same conclusion. The sequence is generated by multiplying each term's position by one more than the position. Therefore, the next two numbers are 42 and 56. \n\nLet me just make sure there isn't another possible pattern. For example, sometimes sequences can involve factorials or other operations, but in this case, the multiplication pattern seems straightforward. Let me check if the differences could also be explained by another rule. The differences are 4, 6, 8, 10,... which is an arithmetic progression with first term 4 and common difference 2. So the difference between term n and term n-1 is 4 + 2(n-2). Wait, let me think. \n\nActually, the first difference (between term 1 and term 2) is 4. If we consider the difference between term k and term k-1 as 2k + 2? Wait, maybe not. Let me think again. \n\nAlternatively, since the nth term is n(n+1), then the difference between term n and term n-1 is:\n\nTerm n - Term (n-1) = n(n + 1) - (n - 1)(n)  \n= n² + n - [n(n - 1)]  \n= n² + n - (n² - n)  \n= n² + n - n² + n  \n=\n</think>\n\n",
  "timestamp": "2026-09-16T04:41:41Z"
}