{
  "question_id": "Q11",
  "model": "qwen3:8b",
  "prompt": "Write a clean Python function `is_palindrome(s: str) -> bool` that checks if a string is a palindrome, ignoring non-alphanumeric characters and case. Provide a brief trace of why it works.",
  "response": "<think>\nOkay, I need to write a Python function called is_palindrome that checks if a string is a palindrome, ignoring non-alphanumeric characters and case. Let me think about how to approach this.\n\nFirst, what's a palindrome? It's a string that reads the same forwards and backwards. But the problem says to ignore non-alphanumeric characters and case. So, I need to process the string to remove any characters that aren't letters or numbers, and then convert everything to the same case, like lowercase.\n\nSo the steps I need to take are:\n\n1. Preprocess the input string. Remove all non-alphanumeric characters. How do I do that? Maybe using a filter or a list comprehension. Also, convert all characters to lowercase (or uppercase) to make the comparison case-insensitive.\n\nWait, for example, \"A man, a plan, a canal: Panama\" should be considered a palindrome. After removing non-alphanumeric, it becomes \"AmanaplanacanalPanama\", then converted to lowercase: \"amanaplanacanalpanama\", which is the same forwards and backwards.\n\nSo the plan is:\n\n- Process the string to keep only alphanumeric characters and convert to lowercase.\n- Then check if this processed string is equal to its reverse.\n\nHow to process the string? Let's think. For each character in the string, check if it is alphanumeric. In Python, there's the isalnum() method. But wait, that's for checking if a single character is alphanumeric. So, perhaps we can loop through each character in the string, and collect those that are alphanumeric, then convert them to lowercase.\n\nAlternatively, we can use a list comprehension to filter and convert. For example:\n\nprocessed = [c.lower() for c in s if c.isalnum()]\n\nWait, but the order is important. For each character in s, check if it's alphanumeric. If yes, convert to lowercase and include in the list. Then, the processed string is the concatenation of these characters.\n\nOnce we have that processed string, we can check if it's equal to its reverse. So, for example, processed == processed[::-1].\n\nSo the function would be:\n\ndef is_palindrome(s: str) -> bool:\n    processed = [c.lower() for c in s if c.isalnum()]\n    return processed == processed[::-1]\n\nWait, but what about the case where the original string has non-alphanumeric characters? For example, \"race car\" becomes \"racecar\" which is a palindrome. So this approach should work.\n\nLet me test some examples.\n\nTest case 1: \"A man, a plan, a canal: Panama\" → processed becomes \"amanaplanacanalpanama\", which reversed is the same. So returns True.\n\nTest case 2: \"race car\" → processed is \"racecar\", which is a palindrome. True.\n\nTest case 3: \"abc\" → processed is \"abc\", reversed is \"cba\" → not equal. So returns False.\n\nAnother test case: \"A\" → processed is [\"a\"], reversed is same. Returns True.\n\nWhat about empty string? Well, the function would return True because the processed list is empty, and empty list reversed is same. But according to the problem statement, maybe the input is non-empty? Well, the function should handle it.\n\nBut wait, the problem says \"checks if a string is a palindrome\". So empty string is considered a palindrome? Well, technically yes, because it reads same forwards and backwards. But maybe the problem expects that. The function as written would return True for empty string.\n\nBut the problem says \"string is a palindrome\", so perhaps the function is correct.\n\nNow, what about characters that are not letters or numbers? Like symbols. The code filters them out.\n\nSo the code seems correct.\n\nBut let me think about the processing step. For example, the code uses list comprehension. So for each character in s, check if it's alphanumeric. If yes, convert to lowercase and add to the list. Then compare the list to its reverse.\n\nYes. So the code should work.\n\nNow, the trace: Why does this work?\n\nBecause the code first filters out all non-alphanumeric characters, ensuring that only letters and numbers are considered. Then, it converts all characters to lowercase (or uppercase) to make the comparison case-insensitive. By comparing the processed string to its reverse, it checks if the string reads the same forwards and backwards, which is the definition of a palindrome.\n\nSo the function works by preprocessing the input string to remove non-alphanumeric characters and normalize case, then checking for palindrome properties by comparing the processed string with its reverse.\n\nI think that's correct. Let me check for possible errors.\n\nWait, what about Unicode characters? For example, characters that are alphanumeric but not in the ASCII range. The isalnum() method in Python handles Unicode characters. For example, 'é' is considered alphanumeric in Python 3. So, if the input has such characters, they would be included. But\n</think>\n\n",
  "timestamp": "2026-09-16T05:29:41Z"
}