{
  "question_id": "Q09",
  "model": "phi4-mini-reasoning",
  "prompt": "You have a 3-liter jug and a 5-liter jug, and an unlimited supply of water. How can you measure out exactly 4 liters using only these two jugs without any measuring scales? Detail every pour step.",
  "response": "<think>\nOkay, so I need to figure out how to measure exactly 4 liters using a 3-liter jug and a 5-liter jug. Hmm, let's see. I remember these kinds of problems usually involve filling, pouring, and emptying different amounts. Let me start by recalling the classic water jug problem solutions. \n\nFirst, maybe I should write down the capacities: 3L and 5L. The goal is to get 4L. Since 4 is between 3 and 5, maybe there's a way to combine them. Let me think step by step.\n\nLet me start by considering the possible states. Each state can be represented by the amount of water in each jug. Let's denote the 5-liter jug as J5 and the 3-liter jug as J3. Initially, both are empty: (0,0). The possible operations are filling a jug to its capacity, emptying a jug, or pouring water from one jug to another until either the source is empty or the destination is full.\n\nI need to find a sequence of operations that leads to 4 liters in one of the jugs. Let me try to outline possible steps.\n\nOne common approach is to fill the larger jug first. So, fill J5 completely: (5,0). Then pour into J3 until it's full. That would leave J5 with 5 - 3 = 2 liters. So now we have (2,3). Then empty J3: (2,0). Pour the remaining 2 liters from J5 into J3. Now J3 has 2 liters, J5 is empty: (0,2). Fill J5 again: (5,2). Pour from J5 into J3 until it's full. Since J3 can take 1 more liter (3-2=1), pour 1 liter into J3, leaving J5 with 5 - 1 = 4 liters. So J5 now has 4 liters. That seems to work!\n\nWait, let me check each step again to make sure.\n\n1. Fill J5 completely: J5=5, J3=0. (5,0)\n2. Pour from J5 to J3 until J3 is full. J5 has 5-3=2, J3=3. (2,3)\n3. Empty J3: J3=0, J5=2. (2,0)\n4. Pour from J5 to J3: J5=0, J3=2. (0,2)\n5. Fill J5 completely: J5=5, J3=2. (5,2)\n6. Pour from J5 to J3 until J3 is full. J3 can take 1 more liter. So pour 1 liter from J5 to J3. J5 now has 5-1=4, J3 is full at 3. (4,3)\n7. Now, we have 4 liters in J5. So that's the solution.\n\nBut let me see if there's another way. Maybe starting by filling J3 first? Let's try.\n\n1. Fill J3: (0,3)\n2. Pour into J5: J5=3, J3=0. (3,0)\n3. Fill J3 again: (3,3)\n4. Pour into J5. J5 can take 5-3=2 liters. So pour 2 liters, J3 has 1 left. (5,1)\n5. Empty J5: (0,1)\n6. Pour the 1 liter from J3 to J5: (1,0)\n7. Fill J3: (1,3)\n8. Pour into J5: J5 can take 4 liters (5-1=4), so pour all 3 liters from J3. Now J5 has 1+3=4, J3 is empty. (4,0)\n\nYes, that also works. So there are at least two methods. But the problem asks to detail every pour step. Let me confirm which one is the standard solution. The first method I thought of is probably the more straightforward one. Let me write out the steps again clearly.\n\nFirst method:\n\n1. Fill the 5-liter jug completely. (5,0)\n2. Pour from the 5-liter jug into the 3-liter jug until the 3-liter is full. This leaves 2 liters in the 5-liter jug. (2,3)\n3. Empty the 3-liter jug. (2,0)\n4. Pour the remaining 2 liters from the 5-liter jug into the 3-liter jug. (0,2)\n5. Fill the 5-liter jug completely again. (5,2)\n6. Pour from the 5-liter jug into the 3-liter jug until the 3-liter is full. Since the 3-liter jug already has 2 liters",
  "timestamp": "2026-09-16T04:13:20Z"
}