{
  "question_id": "Q07",
  "model": "phi4-mini-reasoning",
  "prompt": "All roses are flowers. Some flowers fade quickly. Does it strictly follow that some roses fade quickly? Answer with 'Yes' or 'No' and provide a formal logical justification.",
  "response": "<think>\nOkay, let's see. The problem is: All roses are flowers. Some flowers fade quickly. Does it strictly follow that some roses fade quickly? The answer is either Yes or No, and I need to provide a formal logical justification.\n\nHmm. So first, let's break down the statements. The first premise is \"All roses are flowers.\" In logical terms, that would be a universal statement: For all x, if x is a rose, then x is a flower. Symbolically, ∀x (Rose(x) → Flower(x)). \n\nThe second premise is \"Some flowers fade quickly.\" That's an existential statement: There exists at least one flower that fades quickly. Symbolically, ∃x (Flower(x) ∧ FadeQuick(x)).\n\nThe question is asking if these two premises necessarily lead to \"Some roses fade quickly,\" which is the conclusion we need to evaluate. Symbolically, that would be ∃x (Rose(x) ∧ FadeQuick(x)).\n\nSo, the task is to determine if the conjunction of the two premises (∀x (Rose(x) → Flower(x)) ∧ ∃x (Flower(x) ∧ FadeQuick(x)) ) entails ∃x (Rose(x) ∧ FadeQuick(x)).\n\nI need to check if the first two statements together necessarily make the third one true. In other words, is the conclusion a logical consequence of the premises?\n\nLet me think about this. The first premise says that all roses are flowers, which is a one-way implication. It doesn't say that flowers are all roses. So, there could be flowers that are not roses. The second premise says that some flowers fade quickly, but those flowers could be any kind of flower, not necessarily roses.\n\nFor example, imagine a world where all roses are flowers, but the flowers that fade quickly are daisils, which are not roses. In that case, the premises would be true, but the conclusion that some roses fade quickly would also be true. Wait, no, in that case, the premises are true, but the conclusion is false. Wait, no, if the flowers that fade quickly are daisils, then there are no roses that fade quickly. But the premises don't say anything about roses fading quickly. So in that scenario, the premises are true, but the conclusion is false. Therefore, the conclusion doesn't strictly follow. So the answer would be No.\n\nBut let me verify this with formal logic. Let's see. Suppose we have:\n\n1. ∀x (Rose(x) → Flower(x))  \n2. ∃x (Flower(x) ∧ FadeQuick(x))  \n\nDoes this entail ∃x (Rose(x) ∧ FadeQuick(x))?\n\nTo check for entailment, we need to see if every model that satisfies the premises also satisfies the conclusion.\n\nConsider a model where all roses are flowers. Let's say in this model, there are some flowers that fade quickly, but those flowers are not roses. For instance, let’s take a domain where the only flowers are daisils and roses. The daillils are the ones that fade quickly. But roses are also flowers, but they don't fade quickly. So in this model, premise 1 is true because all roses are flowers. Premise 2 is true because daisils (which are flowers) fade quickly. However, the conclusion ∃x (Rose(x) ∧ FadeQuick(x)) is false because no roses fade quickly. Therefore, the premises can be true without the conclusion being true. Hence, the conclusion does not follow necessarily. So the answer is No.\n\nAnother way to think about it is using syllogism. The problem is testing whether the syllogism is valid. The structure here is:\n\nAll A are B. Some B are C. Therefore, some A are C.\n\nIn traditional syllogism terms, this is a fallacy of the undistributed variable. The first premise is \"All A are B,\" which is valid. The second premise is \"Some B are C.\" The problem is trying to conclude \"Some A are C.\" But this isn't a valid syllogistic form. The middle term B is undistributed in the second premise (\"Some B are C\" is an existential statement, which doesn't distribute). Therefore, the syllogism is invalid. The conclusion doesn't necessarily follow.\n\nSo, in summary, the answer is No because the premises don't provide sufficient information to conclude that roses fade quickly; the flowers that fade quickly could be a different category of flowers that are not roses.\n</think>\n\n\\boxed{No}\n\n**Logical Justification:**  \nThe premises \"All roses are flowers\" (∀x, if x is a rose then x is a flower) and \"Some flowers fade quickly\" (∃x, x is a flower that fades quickly) do not necessarily entail \"Some roses fade quickly\" (∃x, x is a rose that fades quickly). \n\nFormally, consider a model where:  \n1. All roses are flowers (satisfies ∀",
  "timestamp": "2026-09-16T04:10:10Z"
}