{
  "question_id": "Q02",
  "model": "phi4-mini-reasoning",
  "prompt": "A store offers a 20% discount on an item originally priced at $80. What is the final sale price? Show your work.",
  "response": "<think>\nOkay, let's see. The problem is about calculating the final sale price of an item after a 20% discount. The original price is $80. Hmm, right. So, first, I need to figure out what 20% of $80 is, and then subtract that from the original price to get the sale price.\n\nWait, percentage discounts... Yeah, so 20% off means you pay 80% of the original price, right? Or do you calculate the discount amount first and then subtract? Maybe both ways work. Let me think. Either way, the result should be the same. Let me try both methods to check.\n\nMethod 1: Calculate the discount amount and subtract it from the original price. So, 20% of $80 is the discount. To find 20% of 80, I can convert 20% to a decimal, which is 0.20. Then multiply 80 by 0.20. Let me do that: 80 * 0.20. Hmm, 80 times 0.2 is 16. So the discount is $16. Then subtract that from $80: 80 - 16 = 64. So the sale price is $64.\n\nMethod 2: If the discount is 20%, then the customer pays 80% of the original price. So, 80% of 80. Converting 80% to decimal is 0.80. Multiply 80 by 0.80: 80 * 0.80. Well, 80 times 0.8 is also 64. Same result. Okay, that checks out.\n\nWait, just to make sure I didn't make a calculation mistake. Let me verify the multiplication again. 80 times 0.2: 0.2 is the same as 1/5. So 80 divided by 5 is 16. Yep, that's right. Then 80 minus 16 is 64. Correct. Alternatively, 0.8 times 80: 80 times 0.8. 8 times 8 is 64, so 80 times 0.8 is 64. Yep, that's consistent.\n\nSo both methods lead to the same answer, $64. That seems right. I don't think I missed anything here. The problem is straightforward—a 20% discount on an $80 item. No additional taxes or fees mentioned, so the final sale price should be $64.\n</think>\n\nThe original price of the item is $80. A 20% discount means you save 20% of $80, which is calculated as:  \n\\[\n80 \\times 0.20 = 16\n\\]  \nSubtracting this discount from the original price gives:  \n\\[\n80 - 16 = 64\n\\]  \nAlternatively, the final price is \\(80\\% \\times 80\\):  \n\\[\n80 \\times 0.80 = 64\n\\]  \n**Final sale price:** \\boxed{64}",
  "timestamp": "2026-09-16T04:49:55Z"
}