{
  "question_id": "Q12",
  "model": "phi4-mini-reasoning",
  "prompt": "Trace the execution of this Python code snippet and determine the exact printed output:\n\nx = [1, 2, 3]\ny = x\ny.append(4)\nprint(len(x), x == y)\n\nExplain why `len(x)` is affected.",
  "response": "<think>\nOkay, let's see. I need to trace this Python code and figure out what the printed output is. The code is:\n\nx = [1, 2, 3]\ny = x\ny.append(4)\nprint(len(x), x == y)\n\nHmm, first, let's go step by step. So, initially, x is a list containing 1, 2, 3. Then y is assigned to x. So at this point, y and x refer to the same list. Then, y.append(4) is called. The append method adds an element to the end of the list. So y, which is the same as x, now has 4 added. So y becomes [1, 2, 3, 4].\n\nNow, the print statement has two arguments: len(x) and x == y. Let's break that down. The first part is len(x), which would be the length of the original x list. The original x has 3 elements, so len(x) is 3. \n\nThe second part is x == y. At this point, after y was modified, what's the value of x and y? Wait, x was never changed. x is still [1, 2, 3], and y is [1, 2, 3, 4]. So comparing x and y with == would be checking if two lists with different lengths are equal. In Python, two lists are equal only if they have the same elements in the same order. Since one has an extra 4 and the other doesn't, x == y should be False. So the second part is False.\n\nTherefore, the print statement outputs (3, False). The output is printed as these two values separated by a comma, which is the tuple representation. So the exact printed output would be (3, False).\n\nNow, the question also asks why len(x) is affected. Wait, len(x) returns the length of x, which is 3. But y was modified after x. However, x was not changed. So x remains the original list. Therefore, len(x) is still 3. The len(x) here is not affected because x hasn't been modified. The append was done to y, which is a separate variable but initially the same object as x. But since x wasn't reassigned, len(x) always refers to the original list's length. So even though y changed, x itself didn't, so len(x) remains the same. Therefore, the reason len(x) is not affected is that x was not altered; only y was modified. Since x and y are different variables pointing to the same list initially, but modifying y (like appending) doesn't change x's identity. Hence, len(x) stays 3.\n</answer>The code first initializes `x` as `[1, 2, 3]` and `y` as a reference to the same list. When `y.append(4)` is called, `y` becomes `[1, 2, 3, 4]`, while `x` remains unchanged. \n\nWhen the code executes `print(len(x), x == y)`:\n1. `len(x)` evaluates to `3` because `x` still contains three elements.\n2. `x == y` compares the two lists. Since `x` is `[1, 2, 3]` and `y` is `[1, 2, 3, 4]`, the comparison returns `False`.\n\nThus, the printed output is:\n```\n3 False\n```\n\n`len(x)` is **not** affected because `x` itself is never modified. Only `y` is altered, but `x` remains the original list. The length of `x` continues to be `3` regardless of changes to `y`.",
  "timestamp": "2026-09-16T05:17:37Z"
}