{
  "question_id": "Q05",
  "model": "qwen3:8b",
  "prompt": "Three fair standard six-sided dice are rolled simultaneously. What is the exact probability that the sum of the numbers rolled is equal to 10? Express your answer as a simplified fraction and explain each step.",
  "response": "<think>\nOkay, so I need to find the probability that when rolling three standard six-sided dice, the sum is exactly 10. Let me think about how to approach this. \n\nFirst, I remember that when dealing with probabilities involving dice, it's often helpful to figure out the total number of possible outcomes and then determine how many of those outcomes result in the desired sum. Since each die has 6 sides, and we're rolling three dice, the total number of possible outcomes should be 6 multiplied by itself three times. Let me write that down:\n\nTotal outcomes = 6 × 6 × 6 = 216.\n\nOkay, so there are 216 possible outcomes when rolling three dice. Now, I need to find how many of these outcomes result in a sum of 10. \n\nTo do this, I think I need to find all the combinations of three numbers (each between 1 and 6) that add up to 10. Each number represents the result of one die. Let me denote the three numbers as a, b, and c, where each of them is an integer between 1 and 6 inclusive, and a + b + c = 10.\n\nSo, the problem reduces to finding the number of integer solutions to the equation a + b + c = 10 with 1 ≤ a, b, c ≤ 6. \n\nBut how do I count these solutions? I remember something about stars and bars from combinatorics, but I also need to consider the upper limits on each variable (since each die can't exceed 6). Let me recall. \n\nThe standard stars and bars formula for the number of positive integer solutions to a + b + c = n is C(n-1, 2), where C is the combination function. However, this doesn't account for the upper limits on each variable. Since each die can only go up to 6, we need to adjust for that. \n\nAlternatively, maybe I can use generating functions? Or perhaps it's easier to list all possible combinations? Wait, listing might be tedious, but since the numbers are small, maybe manageable. Let me try both approaches and see which works better.\n\nFirst, let me try the stars and bars approach with inclusion-exclusion. \n\nThe equation is a + b + c = 10, with 1 ≤ a, b, c ≤ 6. Let me first adjust the variables to make them non-negative integers. Let me set a' = a - 1, b' = b - 1, c' = c - 1. Then, the equation becomes:\n\na' + 1 + b' + 1 + c' + 1 = 10 ⇒ a' + b' + c' = 10 - 3 = 7.\n\nNow, the problem is to find the number of non-negative integer solutions to a' + b' + c' = 7, where each a', b', c' ≤ 5 (since original variables a, b, c ≤ 6, so subtracting 1 gives ≤5). \n\nThe standard number of solutions without considering the upper bounds is C(7 + 3 - 1, 3 - 1) = C(9, 2) = 36. But this counts solutions where some variables might exceed 5. So we need to subtract those cases where one or more variables are greater than 5.\n\nLet me recall inclusion-exclusion principle here. \n\nFirst, compute the total number of solutions without restrictions: C(9, 2) = 36.\n\nNow, subtract the number of solutions where at least one variable is ≥6. Let's compute that.\n\nLet me define A as the set of solutions where a' ≥ 6, B where b' ≥ 6, and C where c' ≥ 6. We need to compute |A ∪ B ∪ C| and subtract it from the total.\n\nBy inclusion-exclusion:\n\n|A ∪ B ∪ C| = |A| + |B| + |C| - |A ∩ B| - |A ∩ C| - |B ∩ C| + |A ∩ B ∩ C|.\n\nFirst, compute |A|. If a' ≥ 6, let me set a'' = a' - 6 ≥ 0. Then the equation becomes a'' + 6 + b' + c' = 7 ⇒ a'' + b' + c' = 1. The number of non-negative solutions is C(1 + 3 - 1, 3 - 1) = C(3, 2) = 3. Similarly, |B| = |C| = 3. So total for |A| + |B| + |C| = 3*3 = 9.\n\nNext, compute |A ∩ B|. This is the number of solutions where\n</think>\n\n",
  "timestamp": "2026-09-16T04:42:45Z"
}