{
  "question_id": "Q07",
  "model": "deepseek-r1:7b",
  "prompt": "All roses are flowers. Some flowers fade quickly. Does it strictly follow that some roses fade quickly? Answer with 'Yes' or 'No' and provide a formal logical justification.",
  "response": "<think>\nOkay, so I have this logic problem here: \"All roses are flowers. Some flowers fade quickly. Does it strictly follow that some roses fade quickly?\" I need to figure out if the conclusion necessarily follows from the premises. Hmm, let's break this down step by step.\n\nFirst, let's translate the statements into logical terms. The first premise is \"All roses are flowers.\" In predicate logic, that would be something like ∀x (R(x) → F(x)), where R(x) means \"x is a rose\" and F(x) means \"x is a flower.\" So every rose is a flower.\n\nThe second premise is \"Some flowers fade quickly.\" That translates to ∃x (F(x) ∧ Q(x)), where Q(x) means \"x fades quickly.\" So there exists at least one flower that fades quickly.\n\nNow, the question is whether we can conclude that \"Some roses fade quickly,\" which would be ∃x (R(x) ∧ Q(x)). \n\nI remember that in syllogistic logic, if all members of one category (roses) are included in another (flowers), and some members of the second category (flowers) have a certain property (fade quickly), then it follows that some members of the first category (roses) must also have that property. This is similar to the Barbara syllogism, which is a valid form in traditional syllogistics.\n\nBut wait, I should make sure I'm not missing anything. Let me think of an example. Suppose all roses are indeed flowers. Now, if some flowers fade quickly, does that mean some roses do too? Well, since all roses are flowers, any flower that fades quickly could be a rose. So yes, there must be some roses that fade quickly.\n\nAlternatively, if I think about it in terms of sets, the set of roses is a subset of the set of flowers. The set of flowers that fade quickly is a non-empty subset of all flowers. Since roses are entirely within flowers, the intersection of roses and flowers that fade quickly must also be non-empty. Therefore, some roses fade quickly.\n\nI don't think there's a scenario where all flowers that fade quickly are non-roses. Because if all roses are flowers, then any flower that is a rose is part of the set that could fade quickly. So the conclusion seems to hold.\n\nWait, could there be a case where all flowers that fade quickly are non-roses? No, because if all roses are flowers, then the flowers that fade quickly could include roses or not, but since we know some flowers fade quickly, and all roses are flowers, it's possible that some of those flowers that fade quickly are roses. Therefore, it's necessary that some roses fade quickly.\n\nSo, putting it all together, the premises do lead to the conclusion. Therefore, the answer should be 'Yes'.\n\n</think>\n\nYes.\n\nThe conclusion strictly follows from the premises. \n\n1. The first premise states that all roses are flowers, which can be represented as ∀x (R(x) → F(x)).\n2. The second premise states that some flowers fade quickly, represented as ∃x (F(x) ∧ Q(x)).\n3. Combining these, we can infer that there exists at least one x such that R(x) ∧ Q(x), because if all roses are flowers and some flowers fade quickly, those flowers that fade quickly must include roses.\n4. Therefore, some roses fade quickly, which is the conclusion.\n\nThis follows logically using the rules of syllogistic logic, specifically the Barbara syllogism, ensuring the conclusion is valid.",
  "timestamp": "2026-09-16T04:23:56Z"
}