{
  "question_id": "Q08",
  "model": "phi4-mini-reasoning",
  "prompt": "Alice, Bob, and Charlie are sitting in a row. Alice is not on the far right. Bob is sitting to the immediate right of Alice. Who is sitting on the far left? Deduce the exact left-to-right seating arrangement step by step.",
  "response": "<think>\nOkay, let's see. So there are three people: Alice, Bob, and Charlie. They're sitting in a row. The problem says Alice is not on the far right. Bob is sitting to the immediate right of Alice. We need to figure out who's on the far left.\n\nFirst, let me visualize the seating arrangement. There are three seats in a row, so the positions are left to right, let's say positions 1, 2, 3. We need to arrange Alice (A), Bob (B), and Charlie (C) in these positions.\n\nThe key clues here are:\n\n1. Alice is not on the far right. So Alice can't be in position 3.\n2. Bob is sitting to the immediate right of Alice. That means wherever Alice is sitting, Bob is next to her on the right side. So if Alice is in position 1, Bob must be in position 2. If Alice were in position 2, Bob would have to be in position 3. But Alice can't be in position 3 because she's not on the far right.\n\nLet's break it down step by step.\n\nFirst, possible positions for Alice. Since she's not on the far right (position 3), she must be in position 1 or 2.\n\nCase 1: Alice is in position 1. Then Bob, being to her immediate right, would be in position 2. That leaves Charlie in position 3. So the arrangement would be A, B, C. In this case, the far left is Alice. But let's check if this fits all conditions. Alice is not on the far right (she's in 1, which is fine). Bob is immediately right of Alice (1 and 2, correct). So this is a possible arrangement.\n\nCase 2: Alice is in position 2. Then Bob must be in position 3 (immediate right). That leaves Charlie in position 1. So the arrangement would be C, A, B. Here, Alice is in position 2 (not far right), Bob is immediately right of Alice. So this also fits all conditions. In this case, the far left is Charlie.\n\nWait, so there are two possible arrangements? But the question asks \"Who is sitting on the far left?\" which suggests there's a unique answer. Did I miss something?\n\nLet me check again. The problem states that Alice is not on the far right. So in the first case, Alice is on the far left. In the second case, Alice is in the middle. Both are allowed. But Bob must be immediately to the right of Alice. So in the first case, A-B-C, Bob is next to Alice. In the second case, C-A-B, Bob is next to Alice. Both satisfy the conditions. But the problem seems to expect a single answer. Hmm.\n\nWait, maybe there's a constraint I overlooked. The problem says \"sitting in a row\" but doesn't specify if they are sitting in a straight line (so three seats) or a circular arrangement. But the mention of \"far left\" and \"far right\" implies a straight line, not circular. So three seats in a row.\n\nBut the problem allows for two possible arrangements. However, the question is asking \"Who is sitting on the far left?\" So in the first case, Alice is far left. In the second case, Charlie is far left. So how do we determine which is correct?\n\nWait, maybe there's a unique solution. Let me check again. If Alice is in position 2, Bob in 3, Charlie in 1. Then Alice is not on the far right (since far right is 3, she's in 2). So that's okay. So both arrangements are possible. But the problem must have a unique answer. Maybe I made a mistake.\n\nWait, perhaps the problem is designed such that only one arrangement is possible. Let me think again. If Alice is in position 1, then Bob is 2, Charlie 3. Alice is not on the far right (she's on the left), which is okay. If Alice is in position 2, Bob in 3, Charlie in 1. Both are valid. But the problem says \"Alice is not on the far right,\" which is true in both cases. So why would the answer be unique?\n\nWait, maybe the problem is from a source that expects a unique answer, so perhaps there's an implicit assumption. Let me check the problem again: \"Alice is not on the far right. Bob is sitting to the immediate right of Alice. Who is sitting on the far left?\"\n\nWait, maybe the answer is Charlie. Because if Alice is in the middle, Bob is right, then Charlie is left. But if Alice is on the far left, Bob next, Charlie on the right. But both are possible. However, maybe the problem expects that Alice cannot be on the far left because of some other reason. Wait, the problem only states that Alice is not on the far right",
  "timestamp": "2026-09-16T04:11:37Z"
}