{
  "question_id": "Q03",
  "model": "deepseek-r1:7b",
  "prompt": "Calculate the total number of trailing zeroes in 100! (100 factorial). Explain the mathematical reasoning behind your method.",
  "response": "<think>\nOkay, so I need to figure out how many trailing zeros are in 100 factorial, which is written as 100!. Hmm, I remember that trailing zeros are the zeros at the end of a number, right? Like, for example, 100! is a huge number, and it ends with several zeros. But how do I calculate exactly how many?\n\nI think it has something to do with how many times the number 10 is a factor in 100!. Because every time 10 is a factor, it adds a zero at the end. So, if I can find how many times 10 is a factor in 100!, that should give me the number of trailing zeros. But wait, 10 is 2 multiplied by 5, so maybe I need to find how many pairs of 2s and 5s are in the prime factors of 100!.\n\nBut hold on, in any factorial, there are usually more 2s than 5s. So, the number of 5s will determine the number of trailing zeros. That makes sense because 2s are more common. So, I just need to count how many times 5 is a factor in the numbers from 1 to 100.\n\nHow do I do that? I think it's by dividing 100 by 5 and then taking the floor of that result. Let me try that. 100 divided by 5 is 20. So, does that mean there are 20 trailing zeros? Wait, no, that can't be right because I remember that sometimes numbers like 25, 50, 75, and 100 contribute more than one 5. So, I need to account for those as well.\n\nRight, because 25 is 5 squared, so it contributes two 5s, and similarly, 50 is 5 times 10, which is 5 times 2 times 5, so that's two 5s as well. So, I need to not only divide by 5 but also divide by 25 to account for those extra 5s.\n\nSo, let me calculate that. 100 divided by 5 is 20, and 100 divided by 25 is 4. So, adding those together, 20 plus 4 is 24. Hmm, so does that mean there are 24 trailing zeros? But wait, is that all? What about higher powers of 5, like 125? But 125 is greater than 100, so it won't contribute anything. So, I think 24 is the correct number.\n\nLet me verify this. So, in 100!, the number of 5s is the sum of 100 divided by 5, 100 divided by 25, 100 divided by 125, and so on. Since 125 is larger than 100, we can stop at 25. So, 100/5 is 20, 100/25 is 4, and 100/125 is 0. So, adding 20 and 4 gives 24. Therefore, there are 24 trailing zeros in 100!.\n\nBut just to make sure I didn't make a mistake, let me think about a smaller factorial, like 25!. How many trailing zeros does that have? Using the same method, 25 divided by 5 is 5, and 25 divided by 25 is 1. So, 5 plus 1 is 6 trailing zeros. Let me check that. 25! is 15511210043330985984000000. Wait, actually, I think 25! has 6 trailing zeros. Yeah, that seems right. So, my method works for 25!.\n\nAnother example: 50!. 50 divided by 5 is 10, 50 divided by 25 is 2, and 50 divided by 125 is 0. So, 10 plus 2 is 12 trailing zeros. Let me see, 50! is a huge number, but I think it does end with 12 zeros. So, that seems correct.\n\nTherefore, applying the same logic to 100!, it should have 24 trailing zeros. So, I think I can confidently say that the number of trailing zeros in 100! is 24.\n\n**Final Answer**\nThe total number of trailing zeroes in 100! is \\\n</think>\n\n",
  "timestamp": "2026-09-16T04:45:34Z"
}