{
  "question_id": "Q10",
  "model": "qwen3:8b",
  "prompt": "On an island, inhabitants are either Knights (who always tell the truth) or Knaves (who always lie). You meet two inhabitants, A and B. A says: 'At least one of us is a Knave.' Determine precisely what A is and what B is. Provide a rigorous proof by cases.",
  "response": "<think>\nOkay, so I need to figure out whether A and B are Knights or Knaves based on A's statement. Let me start by recalling that Knights always tell the truth, and Knaves always lie. The statement A makes is: \"At least one of us is a Knave.\" \n\nFirst, let me consider the possibilities. There are two inhabitants, A and B. Each can be either a Knight or a Knave. So there are four possible combinations:\n\n1. A is a Knight and B is a Knight.\n2. A is a Knight and B is a Knave.\n3. A is a Knave and B is a Knight.\n4. A is a Knave and B is a Knave.\n\nNow, I need to check which of these scenarios are consistent with A's statement. Let me go through each case one by one.\n\n**Case 1: Both A and B are Knights.**\nIf A is a Knight, then A's statement must be true. The statement is \"At least one of us is a Knave.\" But in this case, both are Knights, so there are no Knaves. Therefore, the statement \"At least one of us is a Knave\" would be false. However, since A is supposed to be a Knight (truth-teller), this leads to a contradiction. Therefore, this case is impossible.\n\n**Case 2: A is a Knight and B is a Knave.**\nSince A is a Knight, A's statement must be true. The statement is \"At least one of us is a Knave.\" In this case, B is a Knave, so the statement is true. Therefore, this case is consistent. So this is a possible scenario.\n\n**Case 3: A is a Knave and B is a Knight.**\nSince A is a Knave, A's statement must be false. The statement is \"At least one of us is a Knave.\" If this statement is false, then the negation must be true. The negation of \"At least one of us is a Knave\" is \"Neither A nor B is a Knave,\" which means both are Knights. However, in this case, we assumed A is a Knave and B is a Knight. Therefore, the negation would be false because A is a Knave. Wait, this seems contradictory. Let me check again.\n\nOriginal statement: \"At least one of us is a Knave.\" If A is lying, then the actual truth is that \"At least one of us is a Knave\" is false, which means \"Neither A nor B is a Knave,\" i.e., both are Knights. But in this case, we have A as a Knave and B as a Knight. Therefore, the actual truth is that A is a Knave, so the negation of the statement is false. Therefore, there's a contradiction here. Therefore, this case cannot hold. Wait, maybe I need to think more carefully.\n\nLet me formalize this. Let me denote:\n\nLet S be the statement: \"At least one of us is a Knave.\"\n\nIf A is a Knave, then S is false. Therefore, the negation of S is true. The negation of \"At least one is a Knave\" is \"Neither A nor B is a Knave,\" which is equivalent to \"Both A and B are Knights.\" However, in this case, we are assuming A is a Knave and B is a Knight. Therefore, the negation would be false because A is a Knave. Therefore, there's a contradiction here. Therefore, Case 3 is impossible.\n\n**Case 4: Both A and B are Knaves.**\nIf A is a Knave, then A's statement is false. The statement is \"At least one of us is a Knave.\" If this is false, then the negation is true: \"Neither A nor B is a Knave,\" meaning both are Knights. But in this case, both are Knaves, so the negation is false. Therefore, this leads to a contradiction. Therefore, Case 4 is impossible.\n\nSo summarizing:\n\n- Case 1: Contradiction.\n- Case 2: Possible.\n- Case 3: Contradiction.\n- Case 4: Contradiction.\n\nTherefore, the only possible case is Case 2: A is a Knight and B is a Knave.\n\nWait, but let me check again. In Case 3, if A is a Knave and B is a Knight, then A's statement is \"At least one of us is a Knave.\" Since A is lying, the truth is that \"At least one of us is a Knave\" is false, which would mean that both are Knights. But in reality, A is a Knave and B is a Knight, so there is at least one Knave (A). Therefore, the statement \"At least one of us\n</think>\n\n",
  "timestamp": "2026-09-16T04:35:11Z"
}