{
  "question_id": "Q07",
  "model": "qwen3:8b",
  "prompt": "All roses are flowers. Some flowers fade quickly. Does it strictly follow that some roses fade quickly? Answer with 'Yes' or 'No' and provide a formal logical justification.",
  "response": "<think>\nOkay, let's see. The question is about whether the statement \"All roses are flowers. Some flowers fade quickly. Does it strictly follow that some roses fade quickly?\" So I need to figure out if the conclusion necessarily follows from the premises.\n\nFirst, let me break down the premises. The first premise is \"All roses are flowers.\" In logical terms, this is a universal statement. So if I denote R as roses and F as flowers, then this would be ∀x (R(x) → F(x)). That means for every x, if x is a rose, then x is a flower.\n\nThe second premise is \"Some flowers fade quickly.\" Let me denote F as flowers and Q as fade quickly. So this is ∃x (F(x) ∧ Q(x)). There exists at least one x that is a flower and fades quickly.\n\nNow, the conclusion is \"Some roses fade quickly,\" which would be ∃x (R(x) ∧ Q(x)).\n\nSo the question is, does the combination of the two premises necessarily lead to the conclusion?\n\nLet me think about logical implications. The first premise says all roses are flowers, so roses are a subset of flowers. The second premise says that some flowers (which could be any subset) fade quickly. But does that mean that some roses must be in that subset?\n\nWait, here's a possible problem. The second premise says some flowers fade quickly, but those flowers could be entirely separate from roses. For example, maybe all the flowers that fade quickly are not roses. So even though all roses are flowers, the flowers that fade quickly might not include any roses. Therefore, the conclusion that some roses fade quickly might not hold.\n\nLet me try to formalize this. Suppose we have a universe of flowers. Let's say there are two groups: roses and non-roses. The first premise says all roses are in the flowers. The second premise says that some flowers (maybe non-roses) fade quickly. There's no information linking the fading quickly to roses specifically. So unless there's an overlap between the flowers that fade quickly and the roses, we can't conclude that some roses fade quickly.\n\nSo, for example, imagine a scenario where all flowers that fade quickly are tulips, and there are no tulips that are roses. Then the premises hold, but the conclusion doesn't. Therefore, the conclusion isn't necessarily true.\n\nTherefore, the answer should be No. The premises don't strictly lead to the conclusion because the set of flowers that fade quickly might not intersect with roses at all.\n\n</think>\n\nNo. \n\n**Formal Justification:**  \nLet R(x) = \"x is a rose,\" F(x) = \"x is a flower,\" and Q(x) = \"x fades quickly.\"  \n- Premise 1: ∀x (R(x) → F(x)) (All roses are flowers).  \n- Premise 2: ∃x (F(x) ∧ Q(x)) (Some flowers fade quickly).  \n\nThe conclusion ∃x (R(x) ∧ Q(x)) (\"Some roses fade quickly\") does not strictly follow. Premise 2 only asserts that some flowers (possibly non-roses) fade quickly. Since roses are a subset of flowers, there is no logical necessity that the flowers fading quickly overlap with roses. For example, all flowers that fade quickly could be non-roses, making the conclusion false while preserving the premises. Thus, the conclusion is not entailed by the premises.",
  "timestamp": "2026-09-16T04:31:23Z"
}